times asked,submitted,keyword,pos,enumeration,tok,eng,examples
6,ijo vivi,example,,,∅ (cf [for example]),an illustration of a rule,mi sona ala kepeken nimi ni. o kepeken ona lon toki. mi o ken sona tan ni. | I don't understand how to use that word. Could you give an **example** in a sentence so I can see how it works?
6,ijo vivi,example,,,"nasin ken, nasin pona",good behavior that encourages imitation,o tawa lon suno laso taso. jan o lukin e **nasin pona sina** o wile sama. | Only walk when the light is green. Set a **good example** for others.
4,,except,,,,,
4,ijo vivi,excited,,,"(pilin) {wile, pona, musi} wawa",enthusiastic or energetic,"tenpo musi kalama li kama poka a. mi **wile a** lon ona! | The concert is happening soon. I'm so **excited** to go!!
nanpa li **musi wawa** tawa mi a. | I get really **excited** about math."
0,jan Tene,exist,v,,lon,to be,lon pi wile mi taso li pona. lon soweli pi wile ala li pona tawa ni. taso **lon** ala li pona nanpa wan. | It is good to be a cynic — it is better to be a contented cat — and it is best not to **exist** at all.
0,ijo vivi,exit,,,"nasin weka, lupa weka",the way out of a building,"seli li kama lon insa tomo la o **weka** kepeken **nasin** poka. | In case of a fire, leave through the nearest **exist**."
0,jan Saki,expect,v,1a,"sona, wile, ∅",to believe that (something) will happen,"**sona** mi **la**, ona li kama lon tenpo poka. | I **expect** them to be here soon."
0,jan Saki,expect,,1b,wile,to believe that something is required (of someone),jan lawa li **wile** e mute a tan mi. | My boss **expects** so much from me.
0,ijo vivi,experience,v,,"{pilin, lukin, kute, ...} e {tenpo, ijo}",to feel with the senses,mi en sina li **lukin** e musi sin lon poka. ni li suli tawa mi. | I'm glad we **experienced** that movie together.
0,ijo vivi,experience,n,,∅,an activity one has performed,tenpo poka la mi o weka e soweli moli tan tomo mi. ni li jaki a tawa mi. | I had to get a dead rat out of my flat recently. It was a horrible **experience**.
0,ijo vivi,experience,n,,sona {nasin},knowledge gathered from past events,sina **sona ala sona** pali lon ilo ni? | Do you have **experience** working this machine?
0,mun Kekan San,explain,,,pana e sona,to provide information,"tenpo kulupu la mi **pana e sona** pi nasin moku kasi. | When class is in session, I'll **explain** how plants get nutrients."
3,ilo Tani,eye,,,lukin,an organ through which animals see,suno wawa li ike e pilin pi **lukin** mi. | Bright lights hurt my **eyes**.
3,lipamanka,fabric,n,,len,a cloth material,"mi tu e **len** li wan sin e ona la mi ken pali e len lawa musi. | If I cut **fabric** and sew it back together, I can make a funny hat. "
7,ilo Tani,face,v,,lukin,"to turn one's face towards, looking at",o **lukin** e suno. | **Face** the light.
7,,face,v,,,to confront,
7,,face,v,,utala,to have an opponent,
7,kala Asi,face,n,,sinpin,"the front part, especially of a human head",jan li utala e sina la sina kama ala kama sona e **sinpin** ona? | Did you remember the **face** of the person who attacked you?
7,ijo vivi,face,n,,"pilin, kulupu; kama {ijo} tawa kulupu","reputation, public image",mi wile ala **kama ike** tawa jan ale! | I don't want to **lose face** before everyone!
0,kala Asi,fact,,,"sona, lon",something grounded in truth,"o pini e toki pilin. o open e toki pi **sona lon**. | Let's move on from opinions and consider the **facts**.
pilin sina la ona li jo e mani mute. taso **lon** la ona li jo e mani ala. | You thought he's rich, but **in fact** he's penniless."
0,kala Asi,fact,,,"∅, ni","""the fact that ..."" — a relative clause cliché",toki Lusi li kepeken sitelen Kililisa. **ni** li ike e ken sona mi. | **The fact that** Russian uses Cyrillic makes it hard for me to read.
0,,fade,,,,,
2,,fail,,,,,
3,,fair,,,,,
0,,faith,,,,,
0,,fake,,,,,
7,kala Asi,fall,,,tawa anpa,move downwards,lipu kasi li **tawa anpa**. | The leaves are **falling**.
7,kala Asi,fall,,,kama,become,mi lukin e ona li **kama** olin. | I saw them and **fell** in love.
7,kala Asi,fall,,,"pini, moli",come to an end,"ma Loma nanpa tu li **pini** tan kulupu Tuki. | The second Rome **fell** to the Turks.
jan mute pona li **moli** lon ma utala. | Many good men **fell** in battle."
7,kala Asi,fall,,,"tenpo pan, tenpo pi moli lipu","autumn, season marked by falling leaves and harvest","**lipu kasi li moli la tenpo** ni li kama: sin la mi o tawa tomo sona. | As **fall** is upon us, once again I have to go to school.
lipu mun la **tenpo pan** li tenpo suli nanpa TW li kama lon mun nanpa LTT. | Going by the calendar, **fall** is the third season and starts in September."
0,,fallen,,,,,
7,kala Asi,family,,,kulupu (mama),group of people based on kinship,"**kulupu mama** mi li wile tawa lon telo. taso mi wile ala. | My **family** want to travel by boat, but I don't want to join them."
6,kala Asi,far,,,weka,remote in space or time,"ona li tawa ma **weka**. | She travelled to a **far** land.
tenpo kama **weka** la ken la sijelo jan li pakala ala e pilin ona. | In the **far** future, perhaps, diseases do not cause suffering."
6,kala Asi,far,,,"a, mute","emphatic, very much",mi kama sona e ni: ona li jo e mani mute **a**. | He turned out to be **far** richer than I'd thought.
0,ijo vivi,farm,,,"ma {pan, soweli, waso, ...}",place where crops or livestock are raised,"lon monsi pi tomo mi la mi **mama** e kili moku lon insa **ma**. | In our backyard, we have a carrot **farm**."
28,mute ante,fast,,1,(kepeken) tenpo lili,using little time,mi moku **kepeken tenpo lili**. | I am a **fast** eater.
28,mute ante,fast,,2,wawa,"same as 1, but emphasizing power needed to perform the task quickly",sina pali **wawa** a!! | You worked **fast**!!
4,,fat,,,,,
0,,fate,,,,,
0,ijo vivi,father,,,mama,parent,**mama** mi li weka tawa esun. | My **father**'s out to shop.
0,,fault,,,,,
4,,favorite,,,,,
5,ijo vivi,fear,,,"pilin monsuta, pilin pi ike ken",emotion caused by perceived danger,"mi tawa lon pimeja la mi **pilin e ike ken** ni: kon li kama li moli e mi. | Walking in the dark, I'm always **afraid** that a ghost will come out and murder me."
3,,feed,,,,,
3,ilo Tani,feel,,1a,pilin,to experience an emotion,"suno la mi **pilin** pona, suno ante la pona ala. | Some days I feel well. On other days, not so much."
3,ilo Tani,feel,,1b,"pilin la, pilin e ni",to believe,**pilin** mi **la** pali ni li ken ike a. | I **feel** that this is not a good idea.
3,ilo Tani,feel,,2a,pilin,to sense through touch,"ona li sama kiwen tawa lukin, taso mi **pilin** e ona la ona li ko. | I looked like it was hard, but when I **felt** it, it was like goo."
3,ijo vivi,feel,,2b,"... tawa luka, ... tawa pilin",to be to the touch,kiwen li seli **tawa luka**. | The stone **feels** hot.
3,ilo Tani,feel,,3,∅,to seem,"sina wile kama jo e telo wawa la mani luka luka li mute ike a. | If you're buying an energy drink, ten dollars **feels** like too much."
0,,feet,,,,,
0,,fell,,,,,
0,,felt,,,,,
6,mute ante,femboy,,,(jan) mije (pi sama) meli,man who expresses/dresses themself femininely ,
4,jan Tene,few,,,∅,an unspecified number of,mi lukin e jan lon ni. | I saw a **few** people there.
4,jan Tene,few,,,(pi mute) lili,a small number of,o pini! ona **pi mute lili** taso li lon. | Stop! There's only a **few** left.
0,ijo vivi,field,,,(ma) supa,"flat landscape, typically with grass",**ma supa** suli li lon sinpin mi. | A large **field** lay before us.
0,ijo vivi,field,,,"ma pan, ma (pi mama) kasi",a place used to grow crops,monsi tomo la mi **mama** e **pan** lon **ma**. | We have a wheat **field** in our backyard.
0,ijo vivi,field,,,∅,area of study,pali mi la mi alasa e sona sijelo sin. | I'm a scientist in the **field** of anatomy.
0,mun Kekan San,fight,,,utala,"conflict, altercation",soweli mi li wile **utala** tan ni: ona wan li weka e moku tan ona ante. | My cats want to **fight** because one took food from the other.
0,,figure,,,,,
2,,fill,,,,,
0,jan Saki,film,n,1,"selo, lipu",a thin layer,"poki telo ni li jo e **selo** lon insa. selo li awen e ona tan utala telo. | Aluminum cans have a **film** on the inside which protects them from the acidity of the drinks inside.
**lipu** pi kasi lili li lon sewi telo. | There is a **film** of algae on the pond."
0,jan Saki,film,n,2,lipu (pi ilo sitelen),a sheet or strip of material used to take pictures or videos,"tenpo ni la, ilo sitelen li kepeken ala **lipu**. | Cameras these days don't use **film**."
0,jan Saki,film,v,1,sitelen (lon ilo),to record a video of,"soweli li suwi li lukin e mi! mi o **sitelen** e ni **lon ilo**! | Aww, the orangutan's so cute; it's looking at me! I should be **filming** this!"
0,,final,,,,,
2,ijo vivi,finally,,,pini la,at the end,"**pini** pi utala suli **la** tonsi li kama wawa. | After an arduous battle, nonbinary people will **finally** be empowered.
**pini la** mi pana e kili tawa sewi. | **Finally**, I placed a cherry on top."
2,ijo vivi,finally,,,"a, ∅",(indicates exasperation); after a lot of struggle,"tawa suli li pini. mi kama **a** lon tomo mi. | The long journey is over. We're **finally** home.
**pona a**! ijo sin li kama! | **Finally**, a brand new update!"
11,lipamanka,find,,,"kama lukin e, kama kute e, etc",to come across something after searching for it,"mi alasa mute e soweli la mi **kama lukin** e ona. | After searching for the beast, I finally **found** it. "
11,lipamanka,find,,,pilin e ni:,"to opine, often based on past experiences",mi **pilin e ni:** jan li wile a utala. mi sona e ni tan pali mi. | I've **found** that people actually WANT to fight. I know this because of my job. 
0,mun Kekan San,fine,,,pona tawa lukin,having an attractive appearance,"jan wan pi pali mani mi li **pona mute tawa lukin**, taso mi o olin ala e ona. | One of my co-workers looks so **fine**, but I need to not fall for him."
0,mun Kekan San,fine,,,o pana e mani,charge money due to legal infraction,"mi tawa pi wawa ike e ilo mi la jan lawa li kama li toki e ni: mi **o pana e mani**. | I was speeding in my car, and a cop came and **fined** me for it."
0,mun Kekan San,fine,,,(ijo) pona,"precise, exact",mi wile sitelen lon moku suwi la mi o tawa **pona** e luka. | Writing on this cake requires **fine** movements.
0,mun Kekan San,fine,,,pona,"well, adequate, unharmed","mi tawa anpa lon nasin nena, taso mi **pona**. | I fell on the hike up the hill, but I'm **fine**."
2,ijo vivi,finger,,,"luka; palisa luka, luka lili",appendage on the hand,mi wile tu e kili la mi pakala e **luka** mi. | I tried to cut tomatoes and ended up cutting my **finger**.
0,,fingernail,,,see [nail],part of the finger,
0,,finish,,,,,
2,mun Kekan San,fire,,,seli,plasma that gives off [heat],o tawa tomo mi lon tenpo pimeja ni! poka tomo la mi pali e **seli** suli li pali e moku lon ni. | Come to my house tonight! We'll make a big **fire** and cook on it.
5,kala Asi,first,,,nanpa wan,coming before all others in a list,kulupu lipu Tanaka la lipu **nanpa wan** li toki e open ale. | The **first** book of the Tanakh talks about the genesis of the world.
5,kala Asi,first,,,open,to begin with,"taso **open** la kulupu li pana e mani tawa mi. mi o toki e ona. | But **first**, let me tell you about my sponsor."
4,kala Asi,fish,,,kala,a water-dwelling animal or its flesh,"tenpo sike pini MLL la poka pi ma Kanata la jan pi mute ike li alasa e **kala** la kala li pini. | In the 1990s the **fish** stocks in Canadian waters depleted due to overfishing.
tenpo ni la jan o moku ala e soweli e waso. taso ona li awen ken moku e **kala**. | During this period people should not consume meat. **Fish**, however, is still allowed."
0,,fit,,,,,
0,ijo vivi,five,,,luka; tu tu wan,(number),jan pi tomo mi li pali e pan lili mute. mi moku e ona **luka**. | My roommate made 20 cookies. I ate **five** of them.
3,ijo vivi,fix,,,pona (e pakala),[repair],o **pona** e ilo tenpo mi **pakala**. | Please **fix** my watch.
3,ijo vivi,fix,,,wile,"desire, craving",mi awen ala **wile** lukin e ma lon suno ni. | I've gotten my **fix** on touristing for the day.
3,ilo Tani,flag,n,1,"lipu, len",a piece of cloth used as a symbol,**lipu** pi ma Sonko la mun jelo luka li lon. | The **flag** of China has five yellow stars.
3,ilo Tani,flag,v,2,"suli, awen; loje, suno, etc.",to mark as important with the intention to resolve later,"ona li **suli** e pakala mi la, mi pona e ona. | They **flagged** my mistake, so I fixed it.
o **loje** e lipu tan kulupu pi linja toki. | **Flag** that email from the phone company."
0,,flame,,,,,
0,,flesh,,,,,
0,,float,,,,,
5,ilo Tani,floor,n,,"supa, supa anpa",the bottom surface in a room,pakala! telo mi li tawa **supa** tan poki a. | Crap! My drink spilled onto the floor.
0,,flow,,,,,
5,ijo vivi,flower,,,"kasi, kasi suwi, kasi kule",colorful plant often considered beautiful,mi kulupu e **kasi** pi **kule** mute li pana e ona tawa olin mi. | I collected **flowers** in many colors and brought them to my boyfriend.
4,mun Kekan San,fly,n,,pipi,insect,"mi esun e kili palisa la **pipi** kili mute li kama lon tomo mi... | When I bought bananas, a bunch of fruit **flies** came home with them..."
4,ijo vivi,fly,v,1a,"tawa (lon) kon, tawa (lon) sewi, (tawa sama) waso",move through the air,sina pana e sike la ona li **tawa** mi **lon kon**. | You threw the frisbee and it **flew** towards me.
4,ijo vivi,fly,v,1b,tawa (kepeken waso),travel by [airplane],"mi wile **tawa** olin mi la mi o **kepeken waso**. | If I want to visit my partner, I have to **fly**.
ona li awen **kepeken** ilo ni: ona la ona li kama sona e nasin tawa pi ilo waso. | She's still **flying** the plane she trained with when she was first learning."
4,ijo vivi,fly,v,2,"pona, ken",be acceptable (used in the negative),nasin ike sina li **ken** ala lon tomo ni. | This kind of behavior won't **fly** here.
0,ijo vivi,focus,n,,wawa lawa,"attention, concentration",musi Osu en musi sama li wile e **wawa lawa** mute. | Games like osu! require a lot of **focus**.
1,ijo vivi,focus on,v,,"(awen) {lukin, kute} (wawa, pona, taso, ...)","to perceive strongly or solely, often for an extended duration","mi ken ala **kute pona** e toki sina. lawa mi li ken ala weka e kalama poka pi toki ala. | I'm struggling to **focus** on your speech. My brain can't filter out the background noise.
mi ken ala **awen lukin** e lipu lon tenpo suli. lawa mi li kama pilin e ijo ante. | I can't **focus** on reading for a long time. I always get distracted."
4,ijo vivi,fold,v,,"lili, pini, len",to bend a sheet in order to make it compact,"o **lili** e len o poki e ona. | **Fold up** the bedsheets and put them in the drawer.
mi open e lipu ona, li lukin e toki ona ale, li **pini** sin e ona. | I unfolded their letter, read what it said, and **folded** it back **up**."
5,ijo vivi,follow,,,"tawa sama, kute",take the same route as another,sina o lawa e kulupu. mi **tawa sama** sina. | You lead the group. I'll **follow**
5,ijo vivi,follow,,,lon nasin ...,have a certain lifestyle or doctrine,mi **lon** nasin Pawaki. | I **follow** the Baháʼí faith.
5,ijo vivi,follow,,,kute,"on social media, subscribe to someone's posts",sina **kute ala kute** e toki ale mi? | Are you **following** me?
3,kala Asi,food,,,moku,consumable sustenance,sijelo ale li wile e **moku**. | All organisms need **food** to survive.
3,kala Asi,food,,,"pan, ko, kili, soweli, ...",a particular foodstuff,sitelen la **kili** en **kasi** mute li lon. | The picture showed various vegetarian **foods**.
0,,fool,,,,,
3,ilo Tani,foot,,,noka,an organ used by animals to support oneself on the ground,"mi tawa pi mute ike la **noka** mi li kama pakala. | I ran too much, so my **foot** was injured."
3,,foot,,,suli noka (pi ma Juwese),"a unit of measurement equal to 12 inches, most commonly used in the United States","nanpa pi ma Juwese la, suli mi li sama suli noka luka wan. | (In American units) I am about six **feet* tall. "
0,ilo Tani,foot the bill,v,,pana e mani,"to [pay] for something, especially if the cost is high","sina tu li ken ala la mi ken **pana e mani**. | If you two can't, I can **foot the bill**."
39,"ijo vivi, kala Asi",for,prep,1,tawa,"to the benefit of, towards","mi pali e pan suwi **tawa** sina. | I made cookies **for** you.
o **tawa** nena ma! | Run **for** the hills!"
39,kala Asi,for,prep,2,tan,[because of],ona li pona tawa mi **tan** ijo mute. | I like her **for** lots of reasons.
39,ijo vivi,for,prep,3,lon; la,(expressing amounts of time),"suno tu a **la** mi awen lon ni. | We've been waiting here **for** two days.
mi len e mi lon **lon** tenpo suli. | I've been masking my true self **for** a long time."
39,kala Asi,for,,,pona,in favour,"jan luka la **pona**. jan tu la pona ala. | Ten people voted **for**, two against."
5,ilo Tani,for example,,,sama ni,providing an instance demonstrating a pattern or rule,"sina wile toki e ken la, nimi 'sama' li ken pona, sama ni: ""nimi 'sama' li ken pona, sama ni."" | If you want to discuss possibilities, the word 'sama' may be effective; for example, ""nimi 'sama' li ken pona, sama ni."""
0,ijo vivi,force,n,,wawa,"power, energy","ona li lon tomo lili lon telo suli la ona li ken a pilin e **wawa** ona. | Being in a small boat on a great ocean, she really felt the **force** of the water.
**wawa** li wawa ale, ala li ken pini e ona. sinpin li wawa ale li ken pini e ale. ona li kama wan la seme li kama? | Who would win, an unstoppable **force** or an immovable object?"
0,ijo vivi,force,v,,"{lon, tan} wile ala",make someone act against their will,mi pana e moku tawa jan mi **lon wile ala ona**. | I **forced** my kid to eat.
0,,forest,,,,,
0,lipamanka,forever,,,"lon tenpo ale (kama), tawa tenpo ale (kama)",persisting through all future moments,o moku e pan **lon tenpo ale kama.** | Eat bread **forever.**
7,jan Lakuse,forget,v,1a,"weka, weka sona, (kama) sona ala ",to lose knowledge of something,"mi **weka e sona** mute pi tenpo ni: mi jan lili. | I **forget** a lot of my childhood. 
sina **weka** ala **weka** e ilo sina lon poka pi poki telo suli? | Did you **forget** your phone at the poolside? 
mi **kama sona ala** e ni: mi lon ni tan seme. | I **forgot** why I came here. 
tenpo pini la jan Nansi li sona pali e moku ante mute. tenpo ni la ona li **sona ala**. | Previously, Nancy knew how to prepare many different dishes. Now, she has **forgotten**."
7,jan Lakuse,forget,,2,kama ala (pali),to neglect to do something,mi **kama ala** pana e namako tawa kala. | I **forgot** to add salt to the fish. 
0,,forgive,,,,,
0,,forgotten,,,,,
0,,form,,,,,
0,,former,,,,,
0,lipamanka,fortnight,,,suno luka luka tu tu,a period of 14 days and nights,"mi awen lon **suno luka luka tu tu,** taso akesi wawa li kama sin ala. | I waited for a **fortnight,** but the dragon didn't return. "
0,,forward,,,,,
2,,found,,,,,
0,ijo vivi,four,,,tu tu,one more than three,"jan **tu tu** li lon kulupu olin mi. | **Four** people are in my friend group.
mi **tu tu** e pan. | I **cut** the cake **twice** (into **four** pieces)."
7,,free,v,1a,weka tan poki (awen),release from a prison,
7,,free,v,1b,"ken e, pana e ken",give freedom or rights to,kulupu Palasina o **ken ale**! | **Free** Palestine!
7,ijo vivi,free,adj,1,"ken, ken ale, ala li weka e ken mi","unrestrained, with freedom",mi pali e pan la mi ken pana e suwi pi mute wile tawa ona. mi jan **pi ken ale**. | I can put as much sugar as I want in my cookies. I'm a **free** woman.
7,ilo Tani,free,adj,2,wile ala e mani,"costing nothing, free of charge","sijelo jan li kama pakala la ma Kanata la ni li **wile ala e mani**: jan li tawa tomo sijelo la jan sona li pona e sijelo ona. | If you're injured in Canada, it's **free** to go to a hospital and be treated by a doctor."
3,,freedom,,,,,
0,,fresh,,,,,
0,lipamanka,fridge,n,,poki lete,"a receptacle that keeps food items cold, but above freezing","**poki lete** mi li kama e pilin ike wawa lon mi tan ni: lon monsi poki, la poki lili li lon. mi sona ala e insa. | My **fridge** scares me a lot because in the back, there are some small containers. I don't know what's inside them. "
13,kala Asi,friend,,,"(jan) poka, (jan) pona",someone physically and emotionally close and enjoyable,"jan Sankin li pona tawa mi. ike la mi tu li **poka** ala. | I like John Green, but unfortunately we are not **friends**.
ona li pona e mi lon tenpo utala. mi tu li awen **pona**. | He helped me out during the war, and we've remained **friends** since."
13,ijo vivi,friend,,,jan (mi),a nonspecific person from one's social circle,"ni la mi kama pilin e ijo. tenpo poka la **jan** li toki e ijo musi tawa mi. | That reminds me of a funny story a **friend** told me recently.
mi en **jan** tu **ante** li wile lukin e sitelen la mi esun e lipu ken tawa ni. | I bought movie tickets for myself and two **friends**."
13,ijo vivi,friend,,,kulupu,"in the plural: a friend group, a clique",len mi sin li ike tawa **kulupu** mi. | My **friends** think my new jeans are weird.
0,,friendship,,,,,
0,"jan Juwan, (via sona pona)",frog,,,akesi,amphibian,**akesi** li moku e pipi. | The **frog** eats bugs.
9,"lipamanka, kala Asi",from,prep,1,tan,"originating in/at, because of","mi kama **tan** ma Mewika. | I came **from** America.
jan mute li moli **tan** ike sijelo. | Many people die **from** disease."
9,kala Asi,from,prep,2,"en, ∅",indicating differentiation,"pilin mi **en** pilin sina li sama ala. | You opinions differ **from** mine.
ona li sona **e** ike **e** pona. | He knows right **from** wrong."
0,,front,,,,,
0,,frown,,,,,
5,ijo vivi,fuck,interj,1a,"a, ike",(expression of frustration),"tomo kama la tenpo kama li weka suli. — **ike a**. | The next bus only comes in 30 minutes. — **Fuck**.
**aaaaa**, noka mi a!! | **Fuck**, my toe!!"
5,ijo vivi,fuck,interj,1b,"a, mute",(used for emphasis),"a! moku ni li wawa **a**! | Oh! **Fuck**, this stuff tastes good!"
5,ijo vivi,fuck,v,1,"... li ike, ... o anpa",(used to belittle someone),"kulupu la mi o len nasa ala. taso **ona li ike**. mi kute ala. | The guys at work keep saying I dress weird. But **fuck them**, I'll do whatever I want."
5,ijo vivi,fuck,v,2,unpa,to have sex,mi en ona li **unpa** lon ale pi tenpo pimeja. | Me and them were **fucking** all night.
3,ijo vivi,full,adj,1,"ale ken li lon, ijo (sin) ala li ken",having little to no empty space,poki pan la **pan ale ken li lon**. | **All the bread that will fit is in** the breadbox.
3,ijo vivi,full,adj,2,"wile ala moku (sin), ken ala moku",no longer needing to eat,"""sina wile ala wile moku e suwi?"" ni ala; mi **ken ala moku**. | ""Do you want to eat dessert?"" No, I'm **full**."
0,lipamanka,fungus,n,,soko,any organism of the Fungi kingdom,"mi pana e telo kili tawa tomo pimeja li weka tan tomo lon tenpo suli, la mi pilin e ni: mi kama sin, la ma **soko** wawa li lon. | If I leave fruit juice in a dark room and leave the room for a long period of time, I think I'll return to a beautiful **fungus** garden. "
6,kala Asi,funny,adj,1,musi,"amusing, humorous",jan mute a li kama lukin e sitelen **musi** soweli. | The **funny** cat video went viral.
6,kala Asi,funny,adj,2,nasa,unusual,telo li pana e kon pi jaki **nasa**. | The milk smelt **funny**.
6,lipamanka,furry,,,"jan soweli, soweli",member of the furry fandom,kulupu suli pi **jan soweli** li kama lon ma mi. | There's a large **furry** convention happening in my city.
5,ilo Tani,future,n,,tenpo kama,a time yet to be experienced,"**tenpo kama** la mi wile kama sona e toki mute. | In the **future**, I want to learn many languages."
5,ilo Tani,future,adj,,"kama, tenpo kama",occurring in the future,pali pi jan lon li weka e ken pi jan pi **tenpo kama**. | The actions of people of the present are harming the opportunities of **future** generations.
0,lipamanka,gain,v,,kama jo ,to acquire,sina **kama jo** e jan ni: ona li wile pona tawa sina. | You've **gained** a friend. 
0,lipamanka,gain,n,,"sijelo, luka, noka, monsi, etc; pona, wawa, suli",muscles toned from working out,o lukin e **luka wawa** ni a!! | Look at these bicep **gains!!**
0,lipamanka,gain on,v,,"kama lon poka, kama poka lon monsi",to follow closely behind and close the gap over time,"ona li **kama poka lon monsi** mi la mi suli e wawa tawa. | When she started **gaining on** me, I ran faster. "
3,lipamanka,game,n,,musi,an enjoyable system of rules,mi wile **musi** supa lon poka sina tan ni: sina suwi. | I want to play a board **game** with you because you're so sweet. 
3,lipamanka,game,v,,musi (lon ilo),to play with enjoyable programs on computers ,"mi wile **musi** mute **lon ilo,** taso mama li ken ala e ni. | I want to **game** a lot, but my parents don't allow it. "
3,lipamanka,game,v,,"utala, nasa",to mess with or exploit a system,mi **nasa** e nasin mani pi ma Tosi. | I'm **gaming** the German bank system. 
2,lipamanka,gamer,n,,"jan musi, jan pi musi ilo",someone who plays enjoyable programs on computers,"mi toki ala tawa **jan pi musi ilo** tan ni: mi lili, la musi ilo li moli e mama mama mi. | I don't talk to **gamers** because gaming killed my grandma. "
12,"mun Nanseki, pakala Mapuju",gay,adj,,"olin e {meli/mije}, olin e kule sama",attracted to one's own gender (cf '[straight]'),"ona li mije li **olin e mije**. | He's a guy and he's **gay**.
jan mute li kama kulupu. ona ale li **olin e kule sama**. | Many people gathered. They're all **gay**."
0,,gaze,,,,,
0,,geek,,,,,
16,"mute ante, pakala Mapuju",gender,,,"(mije en meli la) poki, kule","social category of man, woman, nonbinary, etc.","**mije en meli la** mi **poki** ala. | I don't fit into the **gender binary**.
**mije la meli la tonsi la** ale o kama e mani sama. | People deserve the same welfare regardless of **gender**."
0,ijo vivi,general,adj,,"kulupu, mute, ale, ∅",involving many or all members of a group,nasin sin li pona e jan **mute**. | The new policy improved **general** quality of life.
0,,general,n,,(utala la) jan lawa,member of the military,
0,,gently,,,,,
7,kala Asi,get,v,1,kama jo,become in possession of,mi en jan olin mi li **kama jo** e soweli lili suwi a! | Me and my partner **got** a pet!
