times asked,submitted,keyword,pos,enumeration,tok,eng,examples
3,ijo vivi,lie,v,2,"lape, lon supa",to rest in a horizontal position,ale suno la mi **lape** lon supa mi li lukin e ilo. mi ike a! | I've been **lying** in bed and looking at my phone all day. I'm so useless!
28,ijo vivi,life,,,"ale, tenpo, nasin",the totality of one's experiences,"olin mi li pona e **ale** mi. | My partners bring joy into my **life**.
mi musi mute ala lon **tenpo** poka. | My **life**'s been pretty boring lately.
**nasin** tonsi mi li pona tawa mi. | I enjoy **life** as a nonbinary person."
28,ijo vivi,life,,,"ijo pilin; ijo li ken {pilin, wile, unpa}",something that is alive; something with feelings and desires; something that can reproduce,**ijo pilin** ala li lon mun ni. | There's no **life** on this planet.
0,,lift,,,,,
2,"ijo vivi, jan Saki",light,adj,,walo,"of a color: pale, close to white",selo pi waso lili li jelo **walo**. | The ducklings' feathers are a **light** yellow. 
2,"ijo vivi, jan Saki",light,n,,suno,visible light or a source of it,sewi li lukin e **suno**. **suno** li pona. | God saw that the **light** was good.
2,jan Saki,light,adj,,lili (tawa luka),"lacking in weight, easy to lift","ona li suli tawa lukin; taso, nasa la, ona li **lili tawa luka**. | It may look big, but it is surprisingly **light**."
75,kala Asi,like,,,pona tawa (ijo),be pleasant to someone,sona nanpa li **pona** tawa mi. | I **like** maths.
75,kala Asi,like,,,pilin pona tan (ijo),"enjoy emotionally, feel good about something",mi **pilin pona** tan sitelen lili ni. | I quite **like** this sticker.
75,ijo vivi,like,,,"pona, pana e pona","on social media, indicate one's enjoyment of a post","a, jan lili taso la sitelen mi li **pona**... | Aw, only a couple of people **liked** my drawing..."
75,kala Asi,like,,,(ijo) lon tenpo mute,have a tendency to,**tenpo mute** la telo li awen li pakala e kiwen nasin. | Water **likes** to collect in puddles and ruin the concrete.
75,kala Asi,like,,,sama,similar,mi ken sona olin **sama** sina. | I could even learn how to love **like** you.
0,jan Niwe,line,n,1,linja,a length of rope or similar material,mi tawa sewi nena kepeken **linja**. | I went to the top of the mountain using a **line**.
0,ijo vivi,line,n,2,linja,drawing or stroke on a paper,mi sona sitelen e nimi kasi kepeken **linja** wan taso. | I know how to write kasi in a single **line**.
0,ijo vivi,line,n,3,(kulupu) nimi poka; toki,group of words next to each other in a document,"sitelen Lasina la **nimi** pi mute ala li ken **lon poka lon lipu**. | In sitelen Lasina, not many words fit on a single **line**.
**toki** pini la lipu li jaki la mi ken ala sona e ona. | The last **line** is too smudgy to make out."
0,ijo vivi,line,n,4,toki,[sentence] of dialogue said by a fictional character,**toki** ni pi akesi Susi li kama e pilin wawa lon mi. | That **line** from Susie fucks me up so much.
0,ijo vivi,line,n,3,"kulupu awen, kulupu wile, kulupu nasin",[queue] of people waiting,"**kulupu wile** suli li lon sinpin esun. | There was a long **line** in front of the shop.
**jan wile** ale o kama lon **nasin**. | Everyone, please form a **line**!"
0,ijo vivi,line,v,1,"kulupu lon poka, pana lon poka",to form a line,o **pana** e lipu ale tawa supa. | **Line** all the books on the shelf.
0,ijo vivi,line,v,2,... li lon poka ...,to be positioned at intervals along a length of space,palisa mute **li lon poka** lon selo nasin. | Many posts **line** the road's boundaries.
0,ijo vivi,line up,v,1,"li poka; li sama lon {sinpin, poka, tenpo ...}",to be at the same point in space or time,"ni li suwi tawa lukin: supa la lipu ale li **suli sama**. lipu ala li suli nasa li nena lon kulupu lipu. | It's satisfying to see all the books **line up** on the shelf. None of them are bigger or jut out from the collection.
**tenpo** kama wile sina en **tenpo** mi pi pali ala li **sama**. | The day you want to come **lines up** with my break."
0,lipamanka,linguistics,n,,"nasin toki, sona toki",the scientific study of language,mi kama sona e **nasin toki** tan jan pi sona pona. ona li pana poka e toki li toki e ante. | I learn **linguistics** from very smart people. They compare languages and discuss their differences. 
0,,lip,,,,,
4,ijo vivi,list,n,,lipu (pi kulupu ijo); kulupu,document mentioning multiple items,"**lipu** li toki e wile ale esun mi. | The **shopping list** has everything I need to buy.
sina kama lon **kulupu** la mi pana e sona sin tawa sina lon sike. | Join our **mailing list** to receive regular updates."
4,ijo vivi,list,v,,"pana e ale, toki e ale",to create or recite a list,mi **toki e** ma **ale** ni: mi lon ona lon tenpo. | We **listed** all the countries we've been to so far.
0,ijo vivi,listen,,,kute,"to [hear] intently, to pay [attention]",mi wile ala **kute** e toki sike mije. | I don't want to have to **listen** to dudes rambling.
0,ijo vivi,listen,,,kute,to obey,"o **kute** e nasin. mi toki la, sina o **kute**. | **Listen** up. When I speak, you have to **listen**."
0,jan Tene,little,adj,1,lili,small in quantity or size,"tenpo kama **lili** la, ma li lukin ala e mi. taso sina lukin e mi. mi lon la, sina lon kin. | In a **little** while the world will no longer see me, but you will see me; because I live, you also will live. "
0,jan Tene,little,adj,2,suli ala,"unimportant, insignificant","o kute a! sina jaki pi **suli ala** o! | Listen up, you **little** shit!"
2,"ijo vivi, pakala Mapuju",live,,,"lon {ma} (lon tenpo mute), awen lon",to settle in a place,"**tenpo mute la** mi **lon** ma Anpu. | I **live** in Hamburg.
mi **awen lon** ma Lipelata lon tenpo sike tu. | I have **lived** in Riberalta for two years."
2,ijo vivi,live,,,"nasin, {mi, sina, ona}",to spend one's [life] a certain way,"a... **nasin** ni anu seme la sina **sina**? | Oh... do you really **live** like this?
mi lon **nasin** wawa sama jan sewi. | We were **living** like kings."
2,ijo vivi,live,,,"musi, pona","to have a fulfilling, enjoyable life",tenpo mute la mi tawa ala tenpo musi li toki ala tawa kulupu. **nasin** mi li **musi** ala. | I rarely go out to events or talk to people. I'm not really **living my life**.
2,mun Kekan San,live,,,pana (lon tenpo ni),"currently active and transmitting, of various media forms","o toki nasa ala! mi **pana lon tenpo** poka! | Don't say anything strange, we're **live** in a moment!"
1,ijo vivi,lmao,interj,,musi,that's funny,la ona li kama kili a! — **musi a**. | And then he turned himself into a pickle! — **Lmao**.
0,ijo vivi,local,,,"ma ni, ma {mi}, poka",[nearby],"mi esun e sitelen sin. jan **pi ma ni** li sitelen e ona. | I bought a new painting from a **local** artist.
mi tawa **ma** Ansetan li kama sona e ni ike: esun moku pona ala li lon **ona**. | When I went to Amsterdam, I was disappointed by the lack of good **local** restaurants."
0,"pakala Mapuju, ijo vivi",location,,,"lon (as preposition), ma",a place (where a stated thing is),"ilo li toki e ni: soweli li **lon** seme? | The device reports the dog's **location**.
kama la jan li lukin e ona lon **ma** pi weka mani. | He was later spotted at the **location** of the robbery.
lukin la lipu mi li weka tan **supa** ona... | Looks like the book is gone from its usual **location**..."
0,,lock,,,,,
10,ijo vivi,lol,interj,,"musi, a a",that's funny,sina sitelen pakala lon ni li pana pi wile ala e nimi jaki! — **aa**. | You typo'd here and accidentally wrote a rude word! — **Lol**.
10,ijo vivi,lol,interj,,a; (use tone of voice),(indicating a light-hearted statement),sina wile lon nasin ni anu seme? | Are you sure that's a good idea? **lol**
0,(via Wasona),lone,adj,,taso,"alone, isolated",mi lukin e waso **taso** laso. | I saw a **lone** turquoise duck.
2,,lonely,,,,,
7,ijo vivi,long,adj,,"suli (sama palisa); suli lon {poka, sinpin, ...}","large on one axis, but narrow on the others","mi moku e pan **suli** a. | I ate a really **long** baguette.
musi la tomo li **suli lon nasin sinpin monsi** li lili lon poka. | It's funny how the car is **long towards the back** and really narrow on the sides."
7,ijo vivi,long,adj,,suli (tenpo),taking a lot of time,"ona li toki lon tenpo **suli** a! | He was talking for so **long**!
tawa kama li **suli**. — ike. | It's gonna be a **long** walk. — Ugh."
0,ilo Tani,look,v,1,lukin,"to see, to direct one's vision towards",o **lukin** e mun! | **Look** at the stars!
0,"ilo Tani, ijo vivi",look,v,2,tawa lukin; lukin la,"to seem, to appear","ilo wan li pona tawa pilin, taso ilo ante li pona **tawa lukin**. | One device feels nice, but the other **looks** nice.
**lukin la** telo li kama kama tan sewi. | **Looks like** it's gonna start raining."
0,ijo vivi,look,interj,,o kute,listen to me,"**o kute**. mije li lukin olin e sina la ni li suli ala tawa mi. | **Look**, I don't care about the way he looks at you."
2,pakala Mapuju,look at,,,kama sona,"to consider, to learn about",mi **kama sona** e esun pi tomo sin. | I'm **looking at** buying a new house.
0,pakala Mapuju,look for,,,alasa,"to search for, to attempt to find",jan Malijo li **alasa** e len suwi. | Mario is **looking for** cute clothes.
0,,loose,,,,,
2,pakala Mapuju,lose,,1a,(li) weka,to no longer be in possession or company of,"len mi li **weka**. | I **lost** my hat.
**weka** pi mama sina la mi wile e pilin pona lon sina. | My condolences on the **loss** of your mother."
2,pakala Mapuju,lose,,2,anpa,to fail or not succeed in a game,kulupu mi li **anpa** tawa kulupu ante. | My team **lost** to the other team.
5,,lost,,,,,
0,ijo vivi,lot,,,mute,a large amount of,"jan Umeko li ike tan ijo **mute**. | There's a **lot** of reasons to hate Umeko.
ona li moku e pan **mute**. | She ate a **lot** of pancakes."
0,ijo vivi,lot,,,ma (supa),"a large, open [field]",mi awen e ilo mi lon **ma** ilo. | We parked our car in the parking **lot**.
2,,loud,,,,,
8,jan Tekinowi,love,v,1,olin,"to enjoy somebody's company platonically, romantically, sexually, etc.",mi **olin** e mije mi. | I **love** my husband.
8,lipamanka,love,v,2,"pona ... (tawa X) , X la ... pona",to enjoy something or somebody,"pan ni li **pona tawa mi.** | **I love** this bread.
**mama mi la** utala li **pona** ala. | **My mom** doesn't **love** fighting."
0,,lover,,,,,
2,ijo vivi,low,,1,anpa,close to the ground,mi lon sewi a lon tomo la mi pilin nasa. mi wile lon supa **anpa**. | I feel funny when I'm high up in a building. I'd rather be in the **low** floors.
2,ijo vivi,low,,3,"(pilin) ike, anpa","sad, depressed",mi sona ala e ni: **pilin anpa** mi li ken wawa ni. | I never thought I could feel this **low**.
2,ijo vivi,low,,2,"(tan ijo) suli; len, weka","of sound: with slow vibrations, like that of a large animal","mi kute e kalama nasa **tan weka**. | I heard a strange, **low** rumbling.
mi kalama e ilo lon kulupu. kalama pi ilo mi li len li lili tawa kalama uta tawa kalama pi ilo ante. | I perform in a band. My instrument makes **low** tones that blend into the vocals and other instruments."
2,,lucky,,,,,
0,,lust,,,,,
0,pakala Mapuju,machine,,,ilo,large and complex device,**ilo** suli ni li tawa seme? | What is this large **machine** for?
0,,mad,,,,,
9,ijo vivi,magic,,1,,"communication with the divine, often to obtain some benefit; a ritual that enables this communication",
9,"ijo vivi, lipamanka",magic,,2,"ken (nasa), wawa (sewi)",a supernatural ability or force,mi utala e jan ike kepeken **wawa** suno mi. | I fight bad guys with my light **magic**.
2,jan Saki,magnet,,1,"ilo (kama, awen, jo)",object capable of attracting iron and similar materials,**ilo** ni li weka e kiwen walo tan ijo jaki ante. | The **magnet** separates iron and steel from other waste.
2,jan Saki,magnet,,2,"(kiwen, lili) awen","small magnetic object used to hold papers, etc. to a magnetic surface",jan sona li pana e lipu tawa sinpin sitelen li **awen** e ona kepeken **kiwen**. | The teacher stuck a paper on the whiteboard with a **magnet**.
2,jan Saki,magnet,,3,li kama e (ijo),object that attracts certain things like a magnet,jan Anselika li **kama e** pipi mute. | Angelica is a bug **magnet**.
0,jan Saki,major,,1,suli,"big, important","mi wile tawa sina; taso, jan lawa li wile e pali **suli** ni lon tenpo poka. | I'd love to go see you, but I have a **major** project due soon. "
0,jan Saki,major,,2,,military rank,
0,mun Kekan San,major,,3,kama sona (e nasin),primary focus of study in a university,"tomo sona suli la mi **kama sona** e nasin pi lawa esun. | In university, I'm **majoring** in business."
5,ilo Tani,make,,,∅,to cause to be,mi o sewi e pan. | We ought to **make** the pie higher.
5,ilo Tani,make,,,kama,to cause to do,mi **kama** e ni: ona li pali e nasin lon sewi telo. | I **made** them build a bridge over the river.
5,ilo Tani,make,,,pali,"to create, build, fabricate",ona li **pali** e tomo lili tawa soweli ona. | She **made** a small house for her dog.
0,mun Nanseki,man,n,1a,"mije, mije suli",a masculine adult,mi olin e **mije**. | I love **men**.
0,mun Nanseki,man,n,1b,jan,a person,**jan** li tawa nasin telo. | A **man** has fallen into the river.
0,mun Nanseki,man,n,1c,jan (ale),humanity (especially as opposed to other species),"tawa ni li lili tawa jan wan, li suli tawa **jan ale**. | That's one small step for a man, but one giant leap for **mankind**."
4,jan Tene,many,,,mute,a large number of,kala **mute** li lon telo. | There were **many** fish in the water.
0,"ijo vivi, lipamanka",map,,,"lipu ma, lipu nasin","top-down depiction of an area, used for navigation","sina sona ala e lon sina lon ma Newa Jo, la sina ken kepeken **lipu ma.** | If you get lost in Nueva York, you can use a **map.**"
0,,mark,,,,,
0,lipamanka,market,,,"esun, ma esun",a location of building designated for the exchange of goods,"kon li kama lete la mi tawa **tomo esun** li esun e waso suli tawa moku. | When the air starts to get cold, I go to **market** and buy a big bird to eat. "
3,ilo Tani,marry,,,kama wan,to enter in marriage with one another,mun pini nanpa tu la ona tu li **kama wan**. | They got **married** two months ago.
3,lipamanka,marry,v,,"wan lawa, wan",to be recognized as a couple legally,"mi en meli mi li **wan lawa** la mi jo e supa lon sewi pi lawa mi. | When my wife and I **married,** there was a canopy over our heads. "
0,,mask,,,,,
3,lipamanka,mass,n,1,suli,the amount of stuff in an object,jan li kama ken kama sona e **suli** pi mun ale. | People have learned how to figure out the **mass** of all celestial objects. 
3,lipamanka,mass,n,2,"kulupu, mute",aggregation,"mi esun mute ilo la mi jo e **kulupu** poki. mi o weka e ona. | I shop online so much that I've aggregated a **mass** of boxes. I should get rid of them. 
jan poka mi li pali e pan **mute** la ona li pana e pan tawa mi. | My neighbor makes such a **large mass** of bread that he gives me some of the bread. "
3,lipamanka,mass,n,3,kulupu sewi,a Christian gathering of whorship,"mama mi li wile ala, taso mi tawa **kulupu sewi** li toki e sewi pi jan Jesu. | My parents don't want to, but I go to mass and praise Jesus. "
3,lipamanka,mass,adj,,"ale, suli",significant or all encompassing,"jan ale li toki e ni: ona li lukin e suno tu lon sewi. taso ni li pakala **suli** lukin. | Everyone said that they saw two suns in the sky, but that was a **mass** hallucination. "
0,,master,,,,,
0,lipamanka,mate,n,1,jan poka,a [friend],"mi en **jan poka** mi li wile moku e telo suwi lon pini pali. sina wile ala wile kama? | My **mates** and I wanna grab a couple of sodas after work, are you in? "
0,lipamanka,mate,n,2,"jan unpa, soweli unpa, kala unpa, etc","a sexual partner, usually for reproduction, more frequently for nonhuman animals",waso ni li suli e linja kule ona. ona li wile kama e **waso unpa.** | This peacock is spreading out his colorful feathers to attract a **mate.**
0,lipamanka,mate,v,1,unpa,"to have sex, usually for reproduction, more frequently for nonhuman animals","sina lukin e pipi tu lon kon la ona li kama poka li kama weka li ni sike, la o sona: ona li **unpa.** | If you see two flies in the air and the come together and go apart and repeat that, know that they're **mating.**"
0,lipamanka,mate,v,2,kama e unpa lon ... (lon ...),to cause two organisms to reproduce with one another,"jan sona li alasa **kama e unpa lon** akesi suli kiwen, taso akesi li wile ala la akesi ni nanpa pini li kama moli. | The biologists attempted to **mate** tortoises, but the tortoises didn't want to, so the last one died. "
0,mun Kekan San,mate,v,3,anpa,"(clipping of ""checkmate"") to make a move in chess such that the opponent cannot make a move that will prevent the king from being taken on the following move",mi **anpa** e sina. | I've **checkmated** you.
3,ijo vivi,material,,,"ko, kiwen; ijo; ∅",substance from which another thing is made,"jan li pali e tomo lon musi Manka la ona li wile e **kiwen** sinpin a! | When building a house in Minecraft, you're gonna need **materials** for the walls!
**ijo** seme la jan li pali e supa pi tomo ni? | What **material** is the floor here made of?"
0,,matter,,,,,
0,ijo vivi,may,,,ken,have permission to,"jan sona o. mi **ken ala ken** weka lili tan kute sina? | Teach, **may** I go to the bathroom?"
24,kala Asi,maybe,,,ken,"possibly, perhaps","**ken** la mi sitelen nasa e ni. | **Maybe** I wrote this weirdly.
— ni li tomo anu seme? — **ken** a! | — Does this count as a *tomo*? — **Maybe**!"
0,,maze,,,,,
11,jan Tene,me,,,mi,"the first person singular pronoun, as the object",sina olin ala olin e **mi**? | Do you love **me**?
2,mun Kekan San,mean,n,,"insa, nanpa insa",mathematical average,"sina wan e nanpa ni ale, li lili e ona kepeken mute nanpa la, sina kama sona e **nanpa insa**. | If you sum all these numbers, then divide by how many there are, you'll learn the **mean**."
2,mun Kekan San,mean,,,la,to cause,mi jo e mani ni **la** mi ken awen lon tomo mi! | Having this money **means** I'll be able to keep my home!
2,mun Kekan San,mean,,,wile,intention,"sina **wile** weka tan toki uta, anu seme? | Did you **mean** to leave the voice chat?"
2,mun Kekan San,mean,adj,,"utala, ike","antagonistic, cruel","tomo sona la, jan li ken **ike** tawa sina. | In school, some people can be **mean** to you."
2,mun Kekan San,mean,,,"sona, toki","definition (of a word, symbol)",sitelen ni la sina wile **toki** e seme? | What did you **mean** by this symbol?
7,ijo vivi,meaning,,,"toki, sona","information expressed by a word, phrase, or text",nimi 'kala' li **toki e** seme? | What does the word 'kala' **mean**?
0,ijo vivi,measure,v,,nanpa,"express (a quantity, distance, etc.) using numbers","supa ni li suli seme? o **nanpa** e ona. | Would you **measure out** how big this table is?
mi pali e moku la mi **nanpa** ala e **mute** moku. | I don't **measure** when I cook."
0,ijo vivi,measure,n,,nasin,plan,kulupu lawa li alasa weka e ike sijelo kepeken **nasin** ona sin. | The government is taking new **measures** to eliminate the disease.
8,ijo vivi,meat,n,1,"{soweli, waso, ...}; moku; (moku) sijelo",flesh of an animal used as food,**soweli** li lon moku ale pi esun ni. mi o moku lon ona ala. | All this restaurant's dishes have **meat** in them. Let's eat somewhere else.
8,jan Lisente,meat,n,2,"(sijelo) {soweli, waso, ...}","flesh of an animal, especially when dead",The flies are attracted to the rotting **meat**. | pipi li kama tan **sijelo soweli** jaki.
8,jan Lisente,meat,n,3,(ijo) suli,core,This is the **meat** of the discussion. | ni li **ijo suli** toki.
0,jan Tene,medical,adj,,misikeke,pertaining to medicine,ona li kama sona lon tomo pi sona **misikeke**. | She's going to **medical** school.
2,ijo vivi,meet,,,kama; kama kulupu,to gather in one place,mi ale o **kama** lon tomo mi lon open pimeja. | Let's all **meet** at my house at sundown.
2,ijo vivi,meet,,,lukin,"to encounter on accident, to run into",mi tawa tomo mi la mi **kama lukin** e jan pi kulupu mi! | I **met** my schoolmate on the way home!
2,ijo vivi,meet,,,(kama) sona,to get acquainted with someone,"jan Tanpi o! sina **sona ala sona** e jan mi Akila? | Danbi, have you **met** my friend Akila?"
0,,melt,,,,,
0,ijo vivi,member,,,jan kulupu,person in a group,**jan** pi mute seme li lon **kulupu** sina pi mama kasi? | How many **members** does your gardening club have?
5,lipamanka,meme,n,,sitelen musi,a funny internet image,"jan majuna ale li wile pana e **sitelen musi** tawa mi, taso mi sona ala e musi. | All the older folk are trying to show me **memes**, but I don't get the joke. "
6,ijo vivi,memory,,,sona (tenpo),mental recollection of an event,"**tenpo** musi suli li pini, taso sina awen **sona** e pona ona. | The big convention may be over, but you still have fond **memories** of it."
6,ijo vivi,memory,,,ken awen (sona),ability to recall past events,lawa mi li **ken ala awen sona** e tenpo. | I have a bad **memory**.
0,,men,,,,,
0,,meow,,,mu (soweli),sound made by a cat,jan suwi li **mu soweli** tawa mi. | A cutie **meowed** at me.
0,,mess,,,,,
0,,met,,,,,
5,ijo vivi,metal,,,kiwen,hard material,ilo moku li **kiwen** ni: ona o lon ala poki seli. | Cutlery is made of a **metal** that can't be put in the microwave.
4,"ilo Tani, lipamanka",middle,,1,insa,"a center, midpoint","sina awen lon **insa** pi tomo ni, li moku ala e ko walo lon poka tomo, la mi kama sin li pana e ko walo kin tawa sina. | If you stay in the **middle** of this room, and don't eat the marshmallow on the side of the room, I'll return and give you another marshmallow. "
4,ilo Tani,middle,,2,insa,a point in time between the beginning and end,tenpo pimeja pini la lape mi li pakala lon **insa**. | I woke up in the **middle** of the night last night.
0,ijo vivi,might,v,,ken,to possibly be,ni li **ken** pona a! | This **might** be really good!
0,ijo vivi,might,n,,wawa,power,kulupu li alasa pini e jan ike kepeken **wawa** ale ona. | The army tried to stop the villain with all their **might**.
0,,mile,,,,,
0,ijo vivi,military,n,,kulupu utala,organization that fights in wars,jan lawa ike li kama pana e mani mute tawa **kulupu utala** e mani ala tawa pona kulupu. | The fascist president increased **military** spending and decreased funding for social good.
7,ijo vivi,milk,n,,telo mama,liquid produced by mammals for their offspring,
7,ijo vivi,milk,n,,"telo walo, telo soweli",liquid drunk by humans or used in cooking,
3,kala Asi,million,,,mute,a large amount,jan pi **mute** seme li moli la lawa li kama wile pini e utala? | How many **millions** must die before the powerful decide to end the war?
3,kala Asi,million,,,(wan) ale ale ale,precisely a thousand thousands,utala musi la sina wawa! sina kama jo e mani **WAAA** pi ma Mewika. | You have succeeded at the competition! You will be awarded 1 **million** USD.
0,ijo vivi,mind,n,,"pilin, lawa, sona, insa","the brain or its ability to think, feel, focus, or remember","**lawa** mi li pilin e ijo nasa lon tenpo. | My **mind** goes strange places sometimes.
o kama **pilin** ala e unpa lon toki mi! | Get your **mind** out of the gutter!"
0,ijo vivi,mind,v,2,(awen) sona,"to observe, to notice",lupa li lon nasin noka. o **awen sona** e ona. | **Mind** the gap!
0,ijo vivi,mind,v,1,(pilin) suli,"have an [opinion] about, feel strongly","sina la nasin len ona sin li nasa. mi la mi **pilin suli** ala tan ona. | You say you find it weird how he dresses now, but I don't really **mind**."
0,,mine,,,,,
5,"ilo Tani, jan Saki",minute,n,1,"tenpo, tenpo suli, tenpo lili, tenpo insa","a unit of time, 60 of which make up an [hour]","o pana e pan linja tawa ilo seli o seli e ona lon **tenpo suli** tu lon tenpo lili mute luka luka. | Place the noodles in the microwave and heat for two minutes and 30 seconds.
tomo moku la sina ken awen lon tenpo suli wan lon **tenpo lili** mute luka luka. | You may stay at the buffet for one hour and thirty **minutes**.
musi Mawijo pi ilo Ensitepo la, jan li pini e ale musi lon tenpo suli wan, lon **tenpo insa** mute luka luka luka, lon tenpo lili mute luka tu wan. | Someone beat the Mario game on the N64 in one hour, thirty-five **minutes**, and twenty-eight seconds."
5,mun Kekan San,minute,adj,1,lili,small,soweli ni li **lili** wawa a! | This critter is so **minute**!
6,kala Asi,mirror,n,,"sinpin lukin, ilo lukin",smooth surface that reflects an image,"mi **lukin** e mi lon **sinpin**. | I look at myself in the **mirror**.
**ilo lukin** li pana e sitelen ante. | The **mirror** gives off an inverse image. "
6,kala Asi,mirror,v,,sama (ijo),"imitate, represent",pipi ni pi wawa ala la selo li jelo li pimeja. ni li **sama** pipi ante wawa. | The colouring of this insect **mirrors** that of a wasp.
0,lipamanka,misremember,,,sona pakala,"to think one knows something from having learned it, but be incorrect","ike la jan Maka li **sona pakala** e wile ona pi tenpo pini. | Unfortunately, this Micha **misrememers** what they wanted in the past. "
0,,miss,,,,,
0,,mistake,,,,,
0,,model,,,,,
0,,mom,,,,,
0,,moment,,,,,
4,lipamanka,money,n,,mani,currency,"pali mi li pona tawa sina la o pana e **mani** tawa mi lon ilo Pesijon. | If you enjoy my content, give me **money** on Patreon. "
11,kala Asi,month,n,,(tenpo) mun,period related to the Moon's orbit,"**tenpo mun** nanpa luka luka li tenpo mun monsuta. | The tenth **month** of the year is spooky season.
**mun** pi ante toki li pini. | Translation **Month** has ended."
4,ilo Tani,moon,,,mun,a natural satellite of a planet,"tenpo pimeja ni la ale **mun** li suno. | Tonight, the whole **moon** is lit up."
27,ijo vivi,more,,,"mute, sin, namako",additional,"kili ni taso li weka ale ala e wile moku. o pana e kili **sin**! | These fruits alone won't make me full. Could you hand me some **more**, please!"
27,ijo vivi,more,,,tawa (as a preposition),(forms comparatives),ona li suwi **tawa** jan ante ale kulupu. | She's **more** likable than everyone else in the group.
9,ijo vivi,morning,,,open suno,time of day when the sun rises,
9,ijo vivi,morning,,,"tenpo pi pini lape, lape li pini la...",time of day when one wakes up,
