times asked,submitted,keyword,pos,enumeration,tok,eng,examples
4,ijo vivi,quick,,,∅,"(used in polite requests, to suggest that the request won't take up much time)",o alasa e pakala lon lipu mi. | Can you look over my letter **real quick**?
3,,quickly,,,,,
0,jan Saki,quiet,,,kalama ala,without sound,"jan wawa li kama lon supa la, jan ale li kama **kalama ala**. | When the singer came on stage, everyone became **quiet**."
0,,quiet,,,,"peaceful, calm",
0,ijo vivi,quite,,,a,(an intensifier),tomo ni li suli **a**. | That building is **quite** big.
0,mun Kekan San,quite,,,"lili, ∅",(used to downtone),sona ni li pakala **lili**. | That isn't **quite** right.
10,"jan Niwe, lipamanka",raccoon,,,"kijetesantakalu, soweli",an animal in the procyonid family known for stealing garbage from humans,"**kijetesantakalu** li wile moku. | The **raccoon** wants to eat.
**soweli** li weka e moku tan poki. | The **raccoon** stole food from the container."
3,,race,,,,,
0,lipamanka,rag,n,,"len, len pi weka jaki",a small cloth used for cleaning,"**""len pi weka jaki** li lon seme?"" ""a, poki ni."" | ""Where can I find the **rags?""** ""Oh, in that cabinet."" "
0,lipamanka,rag on,v,,toki ike e,to criticize someone,ona li **toki ike e mi** li pini ala a! | She won't stop **ragging** on me! 
0,,rage,,,,,
4,ilo Tani,rain,n,,telo sewi,water droplets that have fallen from condensed clouds,len ale mi li kama jo e **telo** tan **sewi** a... | All of my clothes were soaked from the **rain**...
4,ilo Tani,rain,v,,pana e telo,to have rain fall,suno ni la sewi li **pana e telo** mute. | **It's raining** a lot today.
0,ijo vivi,raise,v,,sewi,"move upwards, lift","mi sike e palisa la supa li **kama sewi**. | When I turn the lever, the platform is **raised**."
0,ijo vivi,raise,v,,mama,"do parenting, bring up, nurture",**mama** mi li nasin Katoliko e mi. | I was **raised** Catholic.
11,ijo vivi,random,adj,,ken ala sona e {nanpa} kama,unpredictable,leko li pana ni e nanpa: mi **ken ala sona e nanpa kama**. | The dice provides **random** numbers.
11,ijo vivi,random,adj,,nasa,"silly, tending to non sequiturs",nasin mi la mi musi tan ijo **nasa** lon tenpo mute. | I have a very **random** sense of humour.
0,ijo vivi,rate,n,,wawa,"[speed], intensity","pali li awen **wawa** ni la ona li pini lon tenpo poka a! | If the work keeps going at this **rate**, it'll be finished in no time!"
0,ijo vivi,rate,v,,"pana e pilin, toki e pilin","[choose], give an opinion on",sina ken lukin e soweli li ken **toki e** ni: ona li suwi ala suwi? | You could **rate** hot moose.
0,,rather,,,,,
0,mun Kekan San,reach,v,,kama jo / tan sewi,"extend a limb, especially to grab",o **kama jo** e namako moku **tan sewi** poki! | **Reach** up to the top of the pantry to get the spices.
0,mun Kekan San,reach,,,kama,to arrive,mi **kama** lon sewi nena! | We've **reached** the top of the mountain!
8,mun Kekan San,read,v,,lukin,receive information through writing,mi **lukin** e lipu mute kepeken ilo pi sinpin walo. | I've **read** a lot of books using my e-reader.
2,mun Kekan San,ready,"adj, v",,pali,"prepared, to prepare",jan ale pi ma tomo ni li **pali** mute la ma tomo li awen pona lon ni: lete wawa li kama. | Everyone in the city got **ready** for the incoming freezing weather.
2,mun Kekan San,real,adj,,lon,part of existence in a verifiable way,"sina weka tan lape. sitelen lape li **lon** ala, li ken ala pakala e sina. | You're awake. Your dream wasn't **real**, and can't hurt you."
2,,real,interj,,lon,remarking on something as true or apt,
0,ijo vivi,real life,,,"ilo ala, musi ala",a situation outside the internet or a video game,"tenpo la mi pali e moku linja pi telo kala pimeja lon musi Manka. taso **musi ala** la mi moku ala e ijo sama. | I've made squid ink pasta in Minecraft before, but I've never had it in **real life**."
0,,reality,,,,,
0,,realize,,,,,
3,mun Kekan San,really,adj,,"mute, a","very, a lot of (a quality)","tomo musi ni li suli **mute**! | This theme park is **really** big!
ma moli li nasa **a**... | Graveyards are **really** spooky..."
3,mun Kekan San,really,interj,,anu seme,qualifying or rhetorical question,ni li lon **anu seme**? | Is that **really** true?
0,lipamanka,reason,n,,tan,motivation,"jan li utala e mi, taso mi sona ala a e **tan!** | People keep arguing with me, but I don't know the **reason!** "
0,lipamanka,reason with,v,,kama e pilin sama lon,to convince,mi sona ala e nasin ni: mi ken **kama e pilin sama lon** mama mi. | I don't know how to **reason with** my dad.
0,,receive,,,,,
0,ijo vivi,recent,,,"sin, pi tenpo poka","[new], temporally [close]","lipu ona **sin** la ona li toki e nasin ni: sona len pi kulupu Kita li kama len ala. | They detailed the GitHub vulnerability in a **recent** blogpost.
musi Manka la ijo sin **pi tenpo poka** li pona mute ala. | **Recent** Minecraft updates haven't been great."
2,ijo vivi,record,v,,lipu,to write down information,kulupu li **lipu** e jan ale ona. | The club **records** all its members.
2,ijo vivi,record,v,,"sitelen; poki, awen",to store video or audio of,"o **sitelen** e tawa musi mi! | Can you **record** the two of us dancing?
o sona: mi **awen** e toki ale sina. | Be aware that everything you say will be **recorded**."
2,ijo vivi,record,n,,lipu,written information,**lipu** mute pi tenpo pini li toki e tonsi. | There are many **records** of third-gender people throughout human history.
7,"ni Salo, kala Asi",red,,,loje,a color,"sijelo jan li jo e telo **loje**. sijelo kala pi noka mute li jo e telo laso. | Humans have **red** blood, and squids have blue blood."
0,,regret,,,,,
0,ijo vivi,relationship,,,olin,romantic partnership,"sina en ona li **olin ala olin** a? | Oh my gosh, are you and her in a **relationship**?"
0,ijo vivi,relationship,,,sama,"state of being similar, having something in common",jan li lukin e nimi mute pi tenpo pini la ona li ken kama e sona e nimi ni: ona li ante mute tawa lukin **li** awen **tan** nimi **mama sama**. | Historical linguistics uncovers the **relationships** between seemingly disparate words.
0,,release,,,,,
0,ijo vivi,remain,,,awen [lon],to stay,"mi pini e pali tu wan. pali tu li **awen lon**. | I finished three tasks. Two tasks are **remaining**.
sina **awen** pilin ala e lon pi toki mi anu seme. | So you **remain** unconvinced, eh?"
12,kala Asi,remember,v,1,awen sona,"retain knowledge, continue to know",mi **awen sona** e ijo sama ni pi tenpo majuna. | I still **remember** similar things from the past.
12,kala Asi,remember,v,2,sona sin,forget but regain the knowledge,mi alasa **sona sin** e ni: lipu suli mi li lon seme? | I'm trying to **remember** where I put my documents.
2,,remind,,,,,
0,ijo vivi,report,v,1,toki,"to discuss, disclose",jan li **toki** e ni: akesi mute li lon nasin ale. | They **reported** thousands of turtles invading every street.
0,ijo vivi,report,n,1,lipu,a document discussing something,**lipu** li **toki** e ijo ale ni: sike ni la mi esun e ona kepeken mani. | The **report** listed everything we'd spent money on this year.
0,,represent,,,,,
0,"kulupu Menasewi, (via sona pona), lipamanka",reptile,,,akesi,"a grouping of terrestrial and semi-aquatic vertibrates that usually excludes birds, mammals, and amphibians","**akesi** ni li jo e selo kiwen. | This **reptile** carries a hard shell.
mi wile ala moku e **akesi** tan ni: mama mi la ni li nasa. | I don't want to eat **reptiles** because my parents told me it would be weird. "
0,ijo vivi,require,,,wile; ken ala ... lon ... ala,"[need], be necessary for","jan li ken linja e palisa kepeken ala luka. ni li **wile** e lawa wawa taso. | People can bend spoons without using their hands. All it **requires** is a strong mind.
telo wawa **ala** la ilo li **ken ala** tawa. | A car **requires** fuel to drive."
0,ijo vivi,research,,,alasa sona,attempt to gain knowledge,"soweli lili walo li pona mute tawa mi la mi **alasa e sona** ona lon ale suno. | I **researched** white mice all day because I like them a lot.
ona li **alasa e sona** toki. | She does **research** into linguistics."
2,ijo vivi,reset,,,sin ale,to return to an initial state,"o **sin** e nasin ilo **ale** la pakala o weka. | **Reset** the device to factory settings, and hopefully the glitch will disappear."
3,ijo vivi,respect,,,"pilin {pona, wawa, suli}",positive opinion,pali ona li **wawa** tawa jan mute. | He's well-**respected** for his work.
3,ijo vivi,respect,,,anpa tawa...,deference,"sitelen ni la jan pan o **anpa** tawa jan utala. | In the movie, farmers are supposed to **show respect** to knights."
3,ijo vivi,respect,,,"pilin {pona, wawa, suli}","have a positive opinion, be impressed by",pali ona pi kulupu mi li **wawa** tawa mi. | I **respect** the work she's been doing for our community.
2,kala Asi,rest,,,lape,"relax, sleep, put on pause",o **lape** pona. | Have a good **rest**.
2,kala Asi,rest,,,moli,euphemistically about death,o **moli** pona. | **Rest** in peace.
2,kala Asi,rest,,,ale ante,"everything else, the remainder",jan wan li toki tawa jan **ale ante**. | One person is talking to the **rest**.
0,,result,,,,,
7,kala Asi,return,v,1,kama sin,come back somewhere,"ma mi la waso li weka lon tenpo lete li **kama sin** lon tenpo seli. | Where I live, birds leave for the winter and **return** in the summer."
7,kala Asi,return,v,2,pana sin,give something back,"sina jo e lipu tan tomo lipu la o **pana sin** e ona tawa tomo. | If you borrow a book from the library, please **return** it."
0,,reveal,,,,,
0,ijo vivi,revive,,,"{lon, kama} sin (e jan moli)",to undo someone's death,"mi lon sin, li **kama sin**, li moli ala. | I'm alive, I'm **revived**, I survived."
5,ijo vivi,rice,,,kasi (telo),plant that grows in water,
5,ijo vivi,rice,,,"pan, pan walo, ko",seeds of this plant which are eaten by humans,
3,,ride,,,,,
12,,right,adj,,,direction opposite of [left],
12,ijo vivi,right,adj,,lon,"true, correct","""tomo seme li suli sewi nanpa wan lon ma ale?"" ""tomo Pu Kalipa, anu seme?"" ""ni li... **lon!**"" | ""What's the tallest building in the world?"" ""The Burj Khalifa?"" ""That's... **right!**"""
12,ijo vivi,right,adj,,pona,morally or ethically acceptable,"kiwen tawa li lon nasin li tawa jan luka. taso, sina open e ilo ni la, ona li pakala e jan wan taso. seme li **pona** tawa sina? | A trolley is hurtling down the tracks towards five people, but it will only hit one person if you flip this switch. What do you think is the **right** thing to do?"
12,mun Nanseki,right,interj,,"lon, sona","true, I understand",
12,kala Asi,right,,,anu seme,confirming the listener's agreement,"kulupu o toki e nasin mani lon tenpo suno kama. pona **anu seme**? | Let's discuss the budget tomorrow. Sounds like a plan, **right**?"
0,,ring,,,,,
2,,rip,,,,,
0,,rise,,,,,
2,ilo Tani,river,,,nasin telo,a large stream of water,"tenpo la telo pi mute ike li kama lon **nasin telo**, li pakala e ijo poka. | Occasionally, too much water flows in a **river**, causing a flood."
0,ilo Tani,road,,,nasin,a large pathway for vehicles,mi wile ala a tawa poka ante **nasin**. | I don't want to cross the **road**.
0,ilo Tani,rock,,,kiwen,a stone made of a formation of minerals,"mi wan wawa e **kiwen** tu la kalama suli li kama. | If I powerfully strike two **rocks** together, it'll produce a loud sound."
0,lipamanka,rocket,,,"tomo, tomo pi weka ma, ilo (tawa mun)",a vessel used for space travel,"jan li tawa mun la ona li kepeken **tomo** suli. | When people set foot on the moon, they used huge **rockets.**"
4,mun Kekan San,role,n,,∅,"power or responsibility, often conveyed by a title and/or within an organization","kulupu mi li pana e musi pi supa suli la, mi jan alasa! | In my troupe's stageplay, I played the **role** of hunter!"
0,,roll,,,,,
2,jan Lisente,room,,,tomo,"a subdivision of a building, made of a floor and at least three walls, if only partial ones",a **tomo** sina li suwi a! | Your **room** is so cozy!
0,"ijo vivi, jan Saki",rope,,,linja (suli),sturdy kind of string,"telo, anu **linja**, anu sike la, sina wile ala wile jo? | Lamp oil, **rope**, bombs; you want it?"
3,,rose,,,,,
0,,round,,,,,
0,ijo vivi,rub,,,"tawa (lon supa), weka e jaki","move something across a surface with high tension, especially in order to clean it",
0,ijo vivi,rub,,,unpa,masturbate,
0,ilo Tani,rule,v,,lawa,to have authority over,"tenpo suli la jan pi ma Loma li **lawa** e ma Inli. | For a long time, the people of Rome **ruled** England."
0,ilo Tani,rule,n,,lawa,"a regulation, law",ma ni la **lawa** wan taso li lon: o awen pona tawa jan ante. | This place only has one **rule**: be good to others.
0,ilo Tani,rule,n,,tenpo lawa,a period of rule,**tenpo lawa** pi jan Elisape nanpa tu li awen lon sike mute mute mute luka luka. | The rule of Queen Elizabeth the Second lasted seventy years.
6,kala Asi,run,v,1,tawa wawa,move with great force,mi wile pona e sijelo mi. mi kama **tawa** kepeken **wawa**. | I decided to get back into shape. I have gotten into **running**.
6,kala Asi,run,v,2,weka,flee,ona li jo wawa e poki mi li **weka**. | He snatched my purse and **ran**.
6,kala Asi,run,v,3,tawa,flow in the manner of a liquid,telo li tan ma nena li **tawa** ma anpa. | Rivers originate in the highlands and **run** to the lowlands.
6,kala Asi,run,v,4,awen,persist across time or space,kulupu ni li **awen** lon sike mute a! | This community has been **running** for years!
6,kala Asi,run,v,5,kepeken,make use of software,mi **kepeken** ilo Winto. | I'm **running** Windows.
6,kala Asi,run,v,6,lawa,be in charge of,jan seme li **lawa** e kulupu ni? | Who **runs** this community?
6,kala Asi,run,v,7,utala (tawa),compete in a race,jan luka luka tu li **utala tawa**. | 12 people **ran** the marathon.
0,,rush,,,,,
0,lipamanka,sacred,adj,1,sewi,to be religious or related to religion,"kalama musi **sewi** li pona ala tawa mi tan ni: mi, la sewi li lon ala. | I don't like **sacred** music because I'm an atheist. "
0,lipamanka,sacred,adj,2,suli,to be important to a group of people,ilo ni pi kalama musi li **suli** a tawa kulupu ni. | This instrument is **sacred** to these people. 
10,jan Lisente,sad,,,(pi) pilin ike,"feeling sorrow, unhappy",mi **pilin ike** tan moli. | Death makes me feel **sad**.
0,,sadness,,,,,
2,jan Lisente,safe,,,"pona, (ken) ike ala","that is not dangerous, that protects from danger",mi pilin e ni: tomo ona la **ken ike** li **ala**. | I feel **safe** in her home.
0,,salad,,,,,
6,lipamanka,salt,,,ko (pi weka telo),"sodium chloride, a rock often used in powdered form in cooking","telo ni li wawa lili la mi o pana e **ko** lili tawa ona. | This broth is pretty weak, so I think I'll add some **salt** to it. "
0,ilo Tani,same,interj,,"mi sama, mi pilin sama",indicating agreement with an opinion,telo ni li pona tawa mi. / **mi pilin kin e ni!** | I like this drink a lot. / Same!
0,ilo Tani,same,adj,,sama,"alike, without differences",n kalama ni tu li **sama** tawa kute mi. | Those two clips sound the **same** to me.
2,,sand,,,,,
0,pakala Mapuju,sanguine,,,"pi telo sijelo, pi telo loje",of or relating to [blood],"monsuta **pi telo loje** li moku e telo loje mute. | The **sanguine** horror consumed vast amounts of blood.
mi moku e moku **pi telo sijelo** li pilin pona. | I savored the **sanguine** delicacy."
0,jan Saki,satire,,,"{toki, lipu, sitelen} (ike) musi","(of media) the act of making fun of the subject, usually to highlight problems with keeping or changing it","lawa ma mi li ike suli ni la, kulupu Anjen kin li ken ala **toki ike** wawa e ona. | My government is so evil, not even The Onion can make good **satire** of it."
2,,save,,,,,
4,ilo Tani,say,,,toki,to communicate verbally,ona li **toki** e ni: ma li supa! | He **said** that the Earth was flat!
2,,scar,,,,,
0,,scare,,,,,
10,jan Lakuse,school,,,kulupu sona,knowledge community,"ni li jan pi **kulupu sona** mi. | This is my schoolmate.
tan jaki Kowi la **kulupu sona** ale li lon ilo li lon tomo ala. | Due to Covid, all schools are virtual and not in physical buildings."
10,jan Lakuse,school,,,tomo (pi kama) sona,institution of knowledge or learning,"jan lili mi li tawa **tomo sona** kepeken ilo pi sike tu. | My child goes to **school** using a bicycle.
tenpo pini la mi **kama sona lon tomo** lon poka pi jan lili ante. | In the past, I learned at **school** with other children."
0,jan Saki,science,,,"sona (pi ijo lon, pi ale lon)",the natural sciences; the objective study of nature,
0,jan Saki,science,,,tan ala pilin,something objective (as opposed to an [art]),"sina pali e pan la, sina ken pona tan lipu sona **tan ala pilin**. | Baking is an exact **science**."
0,,scream,,,,,
0,ijo vivi,sea,,,telo (suli),large body of water,mi tawa lon selo **telo** kepeken supa. | I'm travelling the **seas** on a raft.
3,,search,,,,,
,mun Kekan San,season,,,namako,apply spices to food,"o pana e waso tawa poki, o **namako** e ona. ni o awen lon poki lete lon tenpo pimeja. | Place the chicken in a container, then **season** it. This stays in the fridge over night."
0,mun Kekan San,season,,,"tenpo, kipisi pi tenpo sike",time of the year defined by similar temperature and/or natural phenomena,"**tenpo ni pi tenpo sike** la, kon li lete mute; ko lete li ken kama tan sewi. | In this **season**, the air is very cold, and there can be snowfall."
0,kala Asi,seat,,,"supa, supa monsi",furniture to sit on,jan pi soweli tomo o kepeken **supa monsi** ni. | People with dogs should use this **seat**.
4,kala Asi,second,,,nanpa tu,after the first but before the third,kulupu poka ona li wile e mani. ni la ona li open e pali ona **nanpa tu**. | To sustain the family she had to take a **second** job.
4,kala Asi,second,,,tenpo lili,a very short period of time,o awen lon **tenpo lili** o pilin e sona sin. | Let's pause for a **second** to review what we've learned today.
5,ilo Ikosu Onsa,secret,n,,sona len,a piece of knowledge that is hidden,mi ken ala toki e ni. ni li **sona len**. | I can't tell you. It's a **secret**.
5,ilo Tani,secret,adj,,len,"hidden, not to be revealed",mi toki e nimi **len** tawa ona. | I told him the **secret** password.
0,lipamanka,secular,adj,,sewi ala,not related to religion,"lipu ni li lipu nanpa wan pi **sewi ala** lon ma Elopa. tenpo pini la lipu ale li sewi. | This was the first **secular** book in Europe. Before that, all books were sacred. "
0,mun Kekan San,secure,"n, v",,awen,to hold in place,"o **awen** wawa e tomo lon ko. | Go **secure** the tent on the beach.
tomo li **awen** pona! | The tent is **secure**!"
0,mun Kekan San,secure,"n, v",,awen,"to protect, prevent from harm","mi **awen** e mani ale mi lon poki pi kiwen wawa. | I **secure** all my money in a safe.
mani mi li **awen** pona lon poki. | My money is **secure** in the safe."
0,mun Kekan San,secure,v,,"∅, (kama) jo","to ensure, especially in obtaining something",mi o **kama jo** e lipu tawa waso! | I must **secure** airplane tickets!
3,kala Asi,see,,,lukin,witness with the eyes,sitelen ni la sina ken **lukin** e soweli. | In this picture you can **see** a cat.
3,kala Asi,see,,,sona,form a mental picture of,"sina **sona** ala **sona**? | Do you **see** what I mean?
tenpo kama la sina kama **sona**. | One day you'll **see**."
4,ijo vivi,seed,,,"sike (mama), kiwen (kili)",small pebble that plants grow from,**kiwen** ni li ken **mama** e **kasi** sin. | This **seed** can **grow into** a new **plant**.
4,ijo vivi,seed,,,nasin open,"an initial idea, precursor",ona li lukin e sitelen ni: sike soweli li lon lawa jan. ni li **open** e **nasin** lon lawa ona. | She saw photos of a person wearing a collar and it planted a **seed** in her brain.
0,,seek,,,,,
0,jan Tene,seem,v,,"lukin la, tawa lukin",to appear as something,"**lukin la** ona li kama pilin monsuta li kama pilin ike. | He **seemed** both angered and frightened.
ona li kama pilin monsuta li kama pilin ike **tawa lukin**. | He **seemed** both angered and frightened."
3,ijo vivi,self,,,"{mi, sina, ona}, nasin","one's personality, demeanor",sin la ona li kama musi mute sama **ona** pi tenpo pini. | He's back to being his old cheerful **self**.
3,ijo vivi,self,,,∅,(component of reflexive pronouns in English),"mi toki tawa mi. | I'm talking to my**self**.
pilin ona la ale ona li ike. | He hates him**self**."
0,mun Kekan San,sell,v,,"pana (esun), esun",to provide in exchange for monetary compensation,"tenpo suno pali la mi tawa tomo ni li **pana esun** e kili mute. | Every day I work, I come to this market stall and **sell** fruits and vegetables."
0,mun Kekan San,sell,v,,"toki (e) wawa, pana wawa","to promote, especially via speech",jan poka li **toki e wawa** pi lipu ni tawa mi. | A friend **sold** me on this book.
0,jan Lisente,send,,,pana,to emit one object outwards or to something or someone,mi **pana** e sitelen tawa tawa sina. | I **sent** you the video.
0,ijo vivi,sense,,,"ken pilin, nasin pilin",manner of perception,"jan li ken ala lukin la **nasin pilin** pi lukin ala li suli. | For someone that can't see, the non-visual **senses** are important."
0,ijo vivi,sense,,,sona,[meaning],**sona** ala li lon toki sina anu seme? | What you're saying doesn't make any **sense**!
0,ijo vivi,sense,,,pilin,"to feel, perceive",mi **pilin** e ike taso lon tomo ni a! | I **sense** nothing but evil in that house!
4,ijo vivi,sentence,,,toki,"statement, series of words",**toki** ni li pakala ala. | There are no errors in this **sentence**.
4,ijo vivi,sentence,,,∅,punishment,sina ike la mi pani e kili jaki tawa sina. | I **sentence** you to rotten tomatoes for your crimes.
0,jan Tene,serious,adj,1,"musi ala, lon",earnest or sincere as opposed to being humorous or deceiving,ona li musi ala. ona li toki e lon tawa sina! | He is being **serious**. He's telling you the truth!
0,jan Tene,serious,adj,2,suli,significant or important,ijo mute pi **suli** wawa la mi ken toki musi taso. | There are things that are so **serious** that you can only joke about them.
0,mun Kekan San,serve,v,,"∅, lon",to perform some purpose or role,"sinpin ni li awen e ma la ma li tawa ala tomo mi. | This wall **serves** to hold the ground up, so it doesn't slide toward my house.
ona li **lon** kulupu utala lon tenpo sike tu tu. | They **served** in the military for four years."
0,mun Kekan San,serve,v,,pana,strike a ball to initiate a round of a sport,"ona li **pana** wawa e sike la jan ante li lukin ala e ona! | He **served** the ball so hard, the other guy didn't even see it!"
0,mun Kekan San,serve,v,,pana,"give, provide",o **pana** e moku ni tawa supa lon poka pi open tomo. | **Serve** this food to the table near the front.
0,mun Kekan San,serve,v,,anpa,"defeat, be outperformed","pilin mi la mi wawa lon musi ni. taso ona li **anpa** wawa e mi. | I thought I was good at this game, but I got **served**."
0,jan Saki,server,n,1,"jan pana, jan toki",[waiter]; person who serves food at a restaurant,"tomo ni la, **jan pana** li pona tawa jan ale. | The **servers** are nice to everyone here."
0,jan Saki,server,n,2a,"ilo (weka, lawa)",remote computer hosting an online site or application,**ilo weka** pi kulupu Amason li pakala sin! | The Amazon **servers** are down again!
0,jan Saki,server,n,2b,ilo (lawa),local or physically present hosting computer,mi kepeken **ilo** sina tan ni: ona li wawa a li ken **lawa** e musi. | We'll use your computer as the game **server** since it's beefy enough.
0,,service,,,,,
0,mun Kekan San,set,n,,"kulupu (pi ijo sama), (ijo) sama",matching collection of things,supa moku mi li tan **kulupu sama**! | My dinnerware is from the same **set**!
0,mun Kekan San,set,n,,"kulupu (pi ijo ante), poki","math concept, collection of unique items","**kulupu** la ijo ale o ante. | In a **set**, all objects must be different."
0,mun Kekan San,set,v,,"awen, pana","to place, to affix","o **awen** e poki sina lon supa noka. | **Set** your bag on the floor.
mi **pana** e lipu ale tawa supa pali. | I **set** all my documents on my workbench."
0,mun Kekan San,set,v,,"ante, kama (e)",to change a setting,jan lawa li **ante** e wawa seli lon tomo. | The boss **set** the temperature in the office. 
0,mun Kekan San,several,adj,,mute,multiple (of something),
0,jan Lisente,sex,n,1,unpa,sexual intercourse,**unpa** li pona tawa jan mute. | Many people enjoy **having sex**.
0,ijo vivi,sex,n,2,nasin sijelo,biological category,waso la **nasin sijelo** li ken ante ale lon tenpo. | Chickens' **sex** can change completely over time.
0,,shadow,,,,,
0,,shake,,,,,
0,,shall,,,,,
3,,shape,,,,,
0,,share,,,,,
0,lipamanka,shark,,,kala suli,a large carnivorous fish ,"sama **kala suli** la mi alasa! | Like a **shark,** I hunt!"
7,lipamanka,sharp,,,(jo e) nena (ike),"spiky, piercing","o sona: kasi ni li **jo e nena** mute ni: ona li ken open e selo sina! | Beware, this plant is very **sharp,** and can pierce your skin! "
7,,sharp,,,,an edge able to be used to cut or slash,
7,,sharp,,,,higher in pitch (than expected),
7,,sharp,,,,raised in pitch by exactly a semitone,
0,,shatter,,,,,
6,jan Tene,she,,,ona,(pronoun),**ona** li wile ala kama sona. | **She** doesn't want to study.
6,jan Tene,she,,,meli,specifically designating a woman,**meli** li uta suwi e mije. | **She** kissed him.
0,,shed,,,,,
0,,shine,,,,,
0,,shirt,,,,,
0,,shit,,,,,
2,lipamanka,shoe,n,,"len noka, poki noka",receptacle or apparel for the foot,o esun: **poki noka** tawa lili. sin ale. | For sale: baby **shoes.** Never worn. 
0,jan Lisente,short,adj,,lili,"small in size, particularly in height",jan poka mi li **lili**. | My brother is **short**.
0,,shot,,,,,
14,kala Asi,should,,,o,"issuing an instruction, recommendation",tenpo ale la sina moku e telo suwi. **o** moku e telo pi suwi ala. | You drink juice all the time. You **should** drink water.
14,kala Asi,should,,,sona mi la,as far as I know; expectation from previous knowledge,**sona mi la** tenpo ni la ona li kama. | He **should** be there by now.
0,,shoulder,,,,,
0,,shout,,,,,
